rating,review,location
5.0,"Labor and Delivery was awesome here at this hospital.  Everyone was fantastic. When I would call for things like help walking somewhere or help turning around the nurses came with a smile and were very sweet. After the baby was born, the delivery nurse came in when her shift was over and gave me a big hug. I felt great with the people there!,The delivery room was spacious and the post pardum room was comfortable. Both rooms were private and although you could hear the babies crying in other recovery rooms it was very faint (I slept through it most of the time).,My husband slept nicely on the pull out couch.  The only thing I would complain about would be the on call pediatrician that is assigned if you don't have one picked out is a little insensitive. We had some questions that she found to be rediculous, since she laughed at the fact we were asking the question.,This was our first child so I don't have anything to compare to but we will definitely be back.",Houston Methodist West Hospital
5.0,I enjoyed my stay from the time I walked in the hospital they made me feel so Good! And comfortable! I love there Staff that's my second time in that hospital and they are as good as they look! Every one is so professional! And it's a beautiful Hospital! And clean! I don't wish bad on anyone but if u do go to a hospital go Methodist West in Katy TX,Houston Methodist West Hospital
2.0,"We came here for a simple x-ray of my husband's achilles heel area after a visit to our doctor's office in the adjoining professional building. The facility is very nice,  spacious and sparkling new. Lots of great comfortable waiting/seating areas to accomodate patients & visitors. We had no idea how important that would come to be. After being directed to the area where we would get the x-ray & checking in with the clerk, we sat for an unusual amount of time. We watched several people who had checked in AFTER us called back for their x-rays. My husband went to ask why & was told that they were going to be calling him soon. Then after another wait, he again went to see what was the delay (he was clearly agitated at this point). We were then informed that the x-ray order was not correct (it did not specify which foot) and because of that they needed our doctor to fax over a corrected order before they could proceed. Our issue was not the error as mistakes occur, but no explanation was given to us while we just continued to sit and wait & be passed over by people who had checked in after us. At a minimum, WE could have called our doctor's office to expedite the correction it someone had simply told us the reason for the delay. It just caused my husband a lot of irritation as he was already in an incredible amount of pain & was ready to pick up his meds and get home & this was an unreasonable delay.",Houston Methodist West Hospital
4.0,"Had baby #3 here and LOVE this hospital! The nurses and staff are really nice and really take care of you. I was stunned by how much they do for you and mind you I've had 2 other babies are 2 other hospitals and the service isnt like this one.,The only bad part - the food is not good. Most people dont like hospital food, but the other hospitals werent so bad. I hope Methodist improves their food selection, then I would up it to 5 stars.",Houston Methodist West Hospital
1.0,"My daughter had a head injury and waitecd over 4 hours before she was even seen by a doctor.  There were many other people who came in after her with minor injuries and were seen before her, what the hell??   The woman at the desk copped an attitude with my daughter .... this is ER from HELL",Houston Methodist West Hospital
5.0,Place is about 3-4 years old. Love the customer service here. Great staff. The facility is amazing and I noticed that they tend to patients needs individually. The staff here acts in a very professional manner. On the third floor there is a Starbucks.,Houston Methodist West Hospital
5.0,Delivered my daughter here the nurses and doctors did an amazing job!,Houston Methodist West Hospital
5.0,"I love having Methodist in Katy.,The facility is so clean and new.  Every room is a private room which was so nice, and allowed me to have privacy and made me more comfortable. Family was able to visit me often, which really comforted me.  All the staff I came in contact with was friendly and caring.  They really had my best interest at heart.  It made me feel comfortable and less afraid of the hospital stay.  ,I would recommend this hospital to every one I know.,If I ever have to come back- this is where I will visit.",Houston Methodist West Hospital
1.0,My wife and i had to go this hospital because we were thinking we were having a miscarriage. We had to wait for over an hour in a near empty emergency room to be looked at. The staff other than the ultrasound tech were rude and rough with my wife. We were never given a bed until we were to see the doctor for his explanation. That was four hours in the emergency room. It was not clean to the standards I am accustom. It did not look like a new hospital but a run down one. Never going back. I will go to St Lukes in The Woodlands first.,Houston Methodist West Hospital
5.0,"I can't say enough good things about the care I received at this hospital.  I had been sick and getting progressively worse for several days.  I tried on 2 different occasions to go to Hermann Memorial near my home, both times the wait was going to be hours.  My Dr. finally recommended this hospital and against my better judgement I drove myself.  The emergency dept got me right in.  The ER doctor could have been a bit more pleasant but the nurses were great.  It was determined that I had pancreatitis.  They admitted me and even gave me a ""suite"" usually reserved for VIP's.  The care I received in the 24 hours I spent there couldn't have been any better, despite unpleasant blood draws and the only thing they could give me to sleep was morphine (that's not exactly great sleep LOL).  Not sure I would have gone this route had I know they were not in my insurance network because I wound up paying a huge bill but the care I received could not have been better.",Houston Methodist West Hospital
1.0,The hospital is not very clean and there is blood on one of the bed frames. Also there are no walkers for the patient to use. There are so many issues with hospital ..,San Jacinto Methodist Hospital
3.0,"This is your stereotypical overcrowded ER. The care was adequate, but not my favorite. The triage nurse was pleasant and comforting, but after that point not so much. ,The rest of the hospital is quite nice. Reminds me a lot of a hotel. The signage isn't fantastic, and I ended up wandering all around the floor looking for the right office.",Houston Methodist Willowbrook Hospital
4.0,"No one likes having to go to the hospital, but if you do this is the one to go to. We had our baby here and had to stay a week due to complications. The nurses were very nice and on hand at all times. They would get me anything I asked and shared their knowledge with us about anything we needed. The lactation consultant was the funniest person ever, so enthusiastic about her job. The hospital did make me stay a day longer due to their mistake, and my husband wasn't that happy about that. We had our own private room the whole time we were their and my husband was able to sleep on the couch, although he did fall off once because the cushion isn't connected and he just slid. We didn't have a view at all, but at least the food was decent. It does take 45 min for them to deliver food to you form the time that you call, but they tell you that on the phone, sometimes it takes longer, so don't call when you are hungry. Although when you are having your baby here they automatically bring you food, so if you forget to call in your order you might just get a chicken breast and pudding and veggies to eat.",Houston Methodist Willowbrook Hospital
3.0,My mother has recommended me here so I can see a gyno. The first time I went here it was amazing. I loved it. I was in and out. Now I'm back again to get my depo shot. I've been waiting longer than an hour. And 7 other women who came in later were called in before me where in and out. I'm a little aggravated at that but other than that the nurses are all wonderful and nice!,Houston Methodist West Hospital
1.0,"The sad thing about this place is it is the only hospital in the Katy area that has a Cath lab so if the 911 ambulance thinks you are having a Heart attack or you think you are having a heart attack and are driven to Methodist West Houston...Patient beware.  What I was told after the fact is there are NO Staff Cardiologists there.  They call in a doctor who works out of that hospital and several other hospitals in the area and they come from all over when they are called.  I wanted to get to the Med Center..I knew I was having the Big One.  Being a female...I had to convince them and beg them to take another EKG.  This is when they called CODE BLUE!  I asked again to be transferred with Oxygen to the med center and that is only a 15 minute drive in an ambulance, blaring....This did not happen.  I had some doctor that I could not pronounce his name and he  said I would die in 20 minutes.  I prayed for my life.  I woke up and my husband was with me as was my son.  They told me that the doctor said I had a huge clot in the LAD but no heart damage.  He stented it and I would be fine.  I was not fine and knew it.  This doctor like the other cardiologist, I was told, is not an exclusively  Methodist Cardio.  He makes the rounds of several hospitals.    I still had discomfort but figured it was the stent in the LAD.  Less than 3 weeks later the pains escalated at 3:00AM in the morning.  I was NOT going back to Methodist West Houston to get just anybody, again.  I wanted the Mercedes so my husband flew down the WestPark tollway from Cinco Ranch and made it to the Medical Center ER in 24 minutes.  Thank God there was no traffic at that time.  ER was waiting for me.  I was treated like a queen.  I awoke with two Interventionalist Cardiologists at my side.  They had to put in another stent ..larger than the one that the other doctor at Methodist West Houston had put in.  His was apparently too small causing problems. .  I am now in heart failure with heart damage.  Had things been done differently the first time, 3 weeks earlier at Methodist West, we feel I would not of suffered a second massive heart attack, 3 weeks later.  ,Isn't it a shame that Katy is growing by leaps and bounds and many Seniors are moving here to be closer to their  children and grandchildren.  With Senior Populous we bring medical problems and are more prone to serious health woes. Builders are building more patio Homes for us...Senior Apartments are being built....Even Luby's is getting into the act as they know where the Seniors are and that Seniors love Luby's.....Thank You, Luby's.......But, Methodist West Houston needs their Own Physicians that work out of that hospital exclusively and know the Cath Lab inside and Out.....and chose the right size stent for a patient.  I am truly sorry we moved here for this very reason.  I am scared. And, no Provider  should tell a patient  they have only 20 minutes to live.  Gads.",Houston Methodist West Hospital
1.0,"Ok, my dad was admitted to this hospital late Monday night. I came to visit at 9 am the next morning. He was admitted for muscle spasms and overall pain in his shoulders and back. He has a history of this. He also has a bad heart. The stress from the pain caused his heart to have problems. They needed to control the pain to be able to work on the heart. From 9am-1 pm I was there with him. They decided to put him on a pain pump. That took 4 hours to hook up. He has now been there one whole day since then. His pain has gotten worse. They haven't come up with a plan of action to help him. The pain Dr. Has been less than friendly or helpful. He was also disrespectful to a nurse in front of my mom and dad. It was very unprofessional. I just called my mom to see how he is doing. She was crying and he was screaming. I wouldn't be writing this if I felt they had done everything. From what I have observed and heard, they have not done a damn thing!!!!  Do not go up there if you have a choice. They are useless!!!",Houston Methodist West Hospital
1.0,"This Methodist location (Katy) is horrible & crooked. Their scheduling department is a joke & I had the most frustrating experience with them & the scheduler I got (Rashawnda) was extremely rude & was just a miserable person. I've never been treated like that. When I arrived their registration department was a mess. I waited over two hours, no one knew what they were doing, & when I went to ask what was going on & why I was still waiting I was told ""Sorry, you came at lunch, everyone is on break, there isn't much I can do about that. Just have a seat & we will get to you when we can get to you"". I was in shock & wanted to walk out but I needed the test done & had already taken off of work. After 2 hours I was registered & was told I owed more money than I should have paid. I tried pointing this out to them, but they had no idea what they were doing so I ended up just paying what they said. I later spoke with my insurance company who also agreed I over paid & they helped me get my money back, but, it took about 7 weeks for the hospital to do this. This is unacceptable & most people don't have money to give away because the registration department has no clue what they are doing & can't even read an insurance card. I finally made it to the radiology department & was further shocked. The lady at their check in desk was wrapped up in a blanket! Can you imagine? She was unprofessionally in appearance & behavior. She was gossiping with another employee when I walked up & you could tell from body language she was upset & she handed me a clip board without even turning to face me! She was still gripping to her co-worker. This is supposed to be Methodist mind you! I've never been treated like this. This is an open area & she was talking bad about other radiology technicians not doing their job & how their manager wouldn't fix it. Patients should NEVER hear things like this. I filled out the paperwork & gave it back to her & then waited over 45 minutes for my cat scan. The CT technician that came to get me was nice, but the only word that comes to mind that describes my experience with her is incompetent. Her personal appearance was horrible, her scrubs were dirty, wrinkled, & too large. She looked dirty & had greasy hair, & I, sorry to say she had a horrible order to her  both from her body & her mouth. When someone is poking on you & using needles on you, you want your surroundings & the people taking care of you to be clean. She tried 3 times to start an IV on me & couldn't get it. She was shaking & you could tell she had no idea what she was doing. She took the needle out at know point & I had blood leaking everywhere & she froze! I held a tissue to it! She finally got someone else to help her & they got it first try. This technician apologized for the other one & seemed frustrated with her. I'm assuming from her body language that this happens all the time. The cat scan room was dirty too. There was a sticky mess all over the floor & the machine & I stepped in it & told the technician but she just threw a towel over it! This is unacceptable! My experience at Methodist Hospital's West location was miserable & I will never go there again & I will tell my family & friends not to go there either. This hospital is clearly not an extension of the original Methodist Hospital in the medical center. As another review said I would rather drive to downtown Houston & pay to park then ever come here again. The kicker is I asked to speak to the radiology manager & when she finally came to talk to me she was rude & short with me as well. She clearly had no interest in talking to me & it seemed she was in a hurry. I asked if she could do anything & she said at this hospital they had no ""service recovery"", whatever that is, so her hands were tied.  Now, I'm not an expert in these things, but if you hear abad story of how a patient was treated & don't care to make it better,then you clearly don't belong in healthcare. So disappointed in Methodist West Houston Hospital!",Houston Methodist West Hospital
1.0,"On the morning of February 27th I went to the Methodist Hospital ER in Katy.  I was not impressed with the service for several reasons.,1.  The triage nurse, although friendly, made jokes that, when one is at the ER and having a difficult time, both my husband and I considered inappropriate.  Calling to ask for a room for the night for me as a joke while I am silently freaking out is not helpful.,2.  The doctor, also friendly, was also a little too jokey about my health problem and situation.  I used to work in an ER and Trauma Center, so I understand the humor.  However, I think it is important that staff remember that no one goes to the ER on a Sunday morning (or ever??) for a good time.  Just do your job, do it well and get it done.  Leave the humor at the door.,and finally, 3.  After spending my co-pay of $130, it was found by my doctor at follow up that the ER did not even give me the necessary treatment needed.  Due to the lack of treatment, which was time sensetive, I may face additional health problems in the future.  ,Thanks, guys.,Now that Katy has multiple choices for hospital care, choosing an ER (or healthcare of any kind, for that matter) isn't just a shot in the dark anymore.. you can choose someone you really like and trust.  After my experience on Sunday, I will not be going to Methodist again and I will encourage others to do the same.",Houston Methodist West Hospital
1.0,My wife was transfered there today after being at freestanding ER all day. The Er doctor at Spheir Er Called over and explained everything to the admissions department.  She was a direct Admit into Methodist.   My wife 6 months ago had a shunt put in for Pseduotumor and was having issues with it. She started to have severe headaches and vomiting 2 days ago.   We really did not want to go to Methodist because of our last visit there 2 years ago but were assured by the ER doctor at Spheir that everything was going to be OK because he had went into detail and was sending the new CT scans and x-rays.  Stated that her valve needed to be adjusted because it was draining too much.  So that brings us back to  2 years ago when she was there suffering from severe headaches and vomiting and we went to Methodist.  The attending physician accused my wife of seeking drugs and discharged her even though she was still in severe pain.  The following week we were back at another hospital Christis.  It was there where the ER doctor asked for her ct scan from Methodist West and asked us If they had talked to us about possible MS.  So he then tested her for it and measured her spinal fluid pressure and it was over 40.  So then she was reffered to a neurologist who treated her with meds to decrease fluid and that did not work.  Her eye vision then went bad and she was sent to a neurosurgeon and had a shunt put in immediately.  Well any way she started having problems with the shunt not working correctely yesterday and we went to a free standing ER and was then transfered back to this hospital.  The same attending physician saw her and immediately accused her of seeking pain medication.  I informed him that because of him even though he had nothing to do with this we found out what was wrong with her.  (he ordered the CAT scan but ignored the radiologist's recommendations)  Well anyway he then had her transfered to another hospital because he did not want to deal with her.  I will never go back to this hospital or any hospital that Dr. Tampoe is associated with.  I am in medicine and would never accuse someone of something without knowing all the facts.  Never have I seen my wife treated so poorly.  Never will I go to or ever suggest anyone to go to this hospital.  Methodist should be ashamed that this physician represents them.,Houston Methodist West Hospital
1.0,"We went there for a colonoscopy.  The staff was friendly, however my husband has had colonoscopies at another hospital and their customer service and patient care was by far better than the Methodist.  I looked at how much they billed my insurance and they are EXPENSIVE.  Please stay away from this hospital. The are the most expensive ones  and we were not impressed with their service.  Now we are stuck with an expensive medical bill that could've been avoided.   STAY AWAY FROM THAT HOSPITAL!!!!!!!!!!!!!!!!!!!!!! They are crooks in white robes!!!",Houston Methodist West Hospital
1.0,"Went to Methodist Katy for an mri. Three days before my procedure the hospital called and said insurance is done we do not need any payment at this time. Went to the hospital and waited 30 minutes to be checked in. Then told they didn't have my insurance. Went through all of that again and now they tell me I will have to pay $2,000. I tell them I can pay $600 every 2 weeks. they tell me that I would atleast have to pay $1,000 and I told them I can pay $600. They said well then just leave. I of course took phone numbers of bosses and called and explained what happened. they were apologetic,but I also called my insurance company and  connected me with Katy imaging and their charge for am MRI is $425. I will not go back to Methodist and I am changing doctors,so I will not have my surgery done there. That was inexcusable to treat a patient like that.",Houston Methodist West Hospital
3.0,"Seen in a very short time. They drew blood before the doctor saw me knowing he was going to run some labs. My other diagnostics were back to back cutting the waiting time down. No one check on me to see how my pain was between,mostly after the diagnostics.",Houston Methodist West Hospital
5.0,"I love this place! for years i have had breathing issues and pain everyonekept telling me it was anxiety and dismissed my concerns. I went INto methodist katy and the dr felt that something wasnt right and acted on it. Come to find out i have pulmonary fibrosis. Everyone was so nice to me and very helpful. This is byfar the best hospital i have ever been to. I really have issues with all Memorial herman hospitals, Cy fair and cypress hospitals. This place really blew me away with their caring staff and concern for the patient. They thrive to be the best and they are!",Houston Methodist West Hospital
5.0,"My husband is currently at Methodist waiting a liver transplant. I am so impressed with the hospital, the staff and the doctors. Everyone has gone out of their way to be nice and caring and helpful. During this particularly stressful time it is wonderful to be treated with patience and dignity.,I am sincerely of the impression that if it can be done medically, it can be done at Methodist.,I am so happy our local hospital sent us to Methodist.",Houston Methodist Hospital
5.0,"Woo hoo! As good as it gets! is exactly what I thought! ,After being in this hospital back and forth for an entire week to see my significant other, I felt like we were all friends that met at a cruise in Cozumel to enjoy the experience making our trip pleasant, and that it was. ,All the nurses went over and beyond to take care of my stud muffin, asked if we needed anything, made my over night stay as comfortable as they could, joked around us and just genuinely nice.,Even the staff was nice directing me to all the different rooms that he was in that whole week, they would actually walk me to the elevators, to the halls, or the different buildings so I can walk to the room with ease. ,I am so glad he was checked-in at this hospital!",Houston Methodist Hospital
5.0,"I'm a post heart transplant patient here at Houston Methodist. I had my heart transplant on May 24th, 2009. Now I'm doing great now after 6 years. Now I go to annual checkup here. The staff here are very nice and helpful. The nurses here are very skilled and experience in doing there job with no pain. The nurses here are very nice and eager to talk to there patients and learn about us. There heart lung support is also great too. I am blessed to have Houston Methodist as my family hospital.",Houston Methodist Hospital
5.0,"I want to thank the entire Emergency Room staff for all their incredible work. I have always been treated well. Thank you, especially to Dr. Briese, the greatest E.R. doctor a hospital can have.",Houston Methodist Hospital
5.0,"Can't say enough good things about Methodist Hospital.  ,I think I got to the hospital, via ambulance from the clinic, around 4pm, checked-in, to the room, IV'd up, records reviewed and put into surgery for acute appendicitis by 7pm. ,Had a good private room in Dunn Tower.  One of the nurses said they were eliminating most of the ""shared"" rooms.  Most all would be private.  I like that.  ,Superior nursing staff and assistants. Very thorough and competant. I felt safe in their care.,Went home about 21 hours after laparoscopic surgery. 8 days later, it's all good.,Methodist will be our choice in the future.",Houston Methodist Hospital
5.0,"I took my mother here several times for hospital and appointments and I think highly of this hospital as a Whole. Staff is soo helpful and willing to assist you! Hospital is very clean! If you drive this far to get to medical center, may as well stay for lunch!",Houston Methodist Hospital
