rating,review,location
5.0,"I am a double lung Transplant patient. During my extended illness, I've been admitted to many hospitals, Methodist among them.,I'm now on day 20 of this ""extended vacation,"" now not being able to leave until after my Transplant surgery. If this place was like many, it would be grim indeed. But everyone, and I do mean everyone, on the staff goes out of their way to make sure you're comfortable and as happy as can be. That includes family and caregivers staying with the patients. There really is exceptional care here. ,The rooms are comfortable, with homey furniture and lighting. There's even DVD player and VCR. I will say my view is of another building, which is not very appealing, but that's OK. ,All in all, I would highly recommend this hospital to anyone.",Houston Methodist Hospital
4.0,"I have an autoimmune disease so whenever I have a flare up I am constantly in and out of the hospital and ER room... I should also mention that I live in North Houston like the Willowbrook area and while there is a Methodist in the Willowbrook area I CHOOSE to drive to the medical center to be seen or I will go to the Emergency Care Center at Kirby. I have always received excellent care at this hospital, in the ER, ICU, and on the patient floors. There is always at least 1 standout staff member each time. All of my drs are a part of the Methodist system as well and whenever I need to get a hold of one its always easy for a nurse to contact them. My only complaints are for the food... which I have to be on a special menu and they recently changed it and removed some of my favorite foods... :( also I wish that the cafeteria would be open 24 hours... maybe not full but at least have a self serve place or something... not just for patients but their visitors as well... I have to complain about the parking as well... I know that its the medical center and the hospital has no control over the parking but its confusing how some garages are more expensive than others... Oh well.. I guess its the price you pay... (literally) This will always be my hospital of choice... I am currently awaiting a kidney transplant and luckily this is my transplant hospital as well.",Houston Methodist Hospital
5.0,"I had some outpatient surgery at Methodist and received what I felt was top notch service.  I don't go to the hospital often, but I really felt that everyone that helped me (5+ people throughout the day), gave me VIP treatment.  I was not rushed and I felt well taken care of.,This review is based on my personal experience and all statements made herein reflect my personal opinion only. Your experience may be completely different.",Houston Methodist Hospital
5.0,"Taking care of my Grandma for heart surgery. ,If you've stayed at a 5 star hotel.... this is kind of like it in the Hospital field. This is one NICE hospital. Friendly staff, great cafe with any different dining options, sushi, American, Chinese, etc.... ,Great Free Wi-fi.,Easy Parking Garage.,Short walking distance to many rooms.,This hospital is a 5 star from the interior to the patient care.,Will post photos of hospital son.",Houston Methodist Hospital
5.0,"Well I now must rant and rave about the wonderful care we received while Chris was in this past week for 24-hour EEG monitoring for his epilepsy.  The 4th floor of the Main Bldg is filled with a caring, compassionate, concerned and extremely helpful team of VERY dedicated healthcare providers.,The very first day of admit, we were greeted by a very lovely and kind woman named Monique.  She led us to the room where Chris would be staying for the duration of his testing in Neurology ICU.  I HAVE to point out that we arrived around 7:45am; and when I came back during my lunchtime, Ms. Monique was still here.  When I got off work and came over to have dinner with Chris, Ms. Monique was still here.  I even left for a bit to come home and gather clothing, and Ms. Monique was still here!!  I even asked her if she ever goes home, and she chuckled and informed me she was working a double.  WOW, she had been there like ALL day and possibly close to 24 hours yet still had a wonderful attitude, warm smile and went out of her way to make me comfy.  She gathered bedding and pillows for me and set up my bed so I could get it ready; this is true dedication.,Chris received such incredible care from all the nursing and PCA staff: Christine, Emily, Eva, George.  They were all so dedicated and very kind and compassionate as well, always answering any questions/concerns we had.  Now, I might get this wrong; however I believe they are technicians (I could be wrong) but Mozart and Tamekia (they were doing the monitoring) were very attentive, dedicated and equally compassionate.  We developed a really great bond with Ms. Tamekia who would come check in with us every evening and have a nice little chat and chuckle with us.  She was on-point with every movement Chris made or had, calling into the room to see if everything was fine.,Everyone from the nurses to the PCAs and the techs all work cohesively as a strong team and family when it came to Chris having finally had a seizure.  No one pushed me out of the way at all or asked to me to leave or asked me to step away but rather we all worked together which I thought was absolutely wonderful.  To see this team in action with their dedication, unyielding compassion and swiftness to such an urgent situation was mesmerizing.  ,Having had several unpleasant experiences over the years with different Memorial Hospital locations, it clear that Methodist Hospital is milestones above the rest: they are the BEST.  If you should ever have any kind of issue, emergency or need a really great physician, look to Methodist for your needs.  Trust me, you will not be disappointed.",Houston Methodist Hospital
4.0,"Was in ER from 11.00Am till 9.00pm when I got the room. ER full n crazy. People were lined up in stretchers in corridors like busses line up. But when I got the room relief. Staff awesome excellent professional friendly. This is 3rd floor chest pain unit staff I talking about..Even the doctor and technical staff and  cleaning staff awesome. The nurses Everytime they come explan me in detail abt the medicines injection given to me. Also day goals they plan for each patients.,Wish they employ more people in ER so patients r treated fast.  But like I said the staff awesome Thank you all.hopefully will be discharged today after some tests,Hospital food for patients very strict health food.  Cafeteria food good also.",Houston Methodist Hospital
1.0,"ER EXPERIENCE: Completely crappy. Came in at 3AM because of a chin laceration... And I left at 6AM without being seen because I was tired of waiting. Shame on you for LYING to me and telling me that my wait would be less than an hour when I asked after 1 hour of waiting. I don't normally get this livid but eff you guys. ,There was a geriatric patient who was there even before me and he STILL hadn't been seen. I expected this from a county hospital, not someone I was going as an insurance patient. The waiting isn't as bad as the fact that they straight up LIED to me about it.",Houston Methodist Hospital
5.0,"I was a kidney donor so I went to Houston Methodist (HM) several times for testing, and eventually for surgery and overnight stays.  ,From the very first phone call I received from the donor coordinator to the day of my follow up appointment, I had a wonderful experience.  ,1. Staff:  AMAZING!  ,-Jennifer Hamilton was my donor coordinator and she was always available to answer questions or concerns I had regarding the kidney surgery. If she was busy in clinic, she would return my call or email later in the day. She was very helpful explaining everything along the way and made me extremely comfortable and confident in my decision to donate.,-Dr. Goh was my surgeon and he did a great job- my scar is so small.  He met with me before I was put under to explain what he would do in the surgery and answer any questions I had.  I also saw him during my stay at the hospital and in my follow up appointment a couple weeks later.,-All other stay (living donor bank, front desk, nurses, etc) were very polite and always explained what they were doing and always made sure I was comfortable.,2.Hospital: Thought I was at a hotel!,-Transplant center was busy but they were quick to get people through, there is free coffee, tea, water bottles, and hot chocolate in the waiting room, a TV and plenty of sitting room.,-recovery floor: my room was not what I expected or anything compared to the room my boyfriend is currently in.  There was a bathroom, a tv, couch, desk, table, dresser, etc.  It was cleaned daily and it was carpet which was so much better than the cold floors.  I felt like I was staying in a hotel  (minus the pain, and having to get my vitals taken and medicine given) but when they did wake me up at night they didn't turn the lights on and were quick so I could fall back asleep.  If my arm was accessible they wouldn't wake me and just change my IV while I was sleeping. They also made sure my guests that stayed the night were comfortable and had plenty of blankets.  The nursing staff was quick to respond to the call button or anything I had asked for.,3. Food: won't go hungry,patients: Since I was on a restricted liquid diet for a couple days, I can't really say much since options were limited.  Once my diet changed I was able to order whatever I wanted off the menu.  I'm pretty sure I ate a ton of ice cream. You can call for room service at anytime.  The food was pretty good too. They also came around in the afternoon with a snack cart to each room to offer fruit, coffee or juice, and cookies or brownies.  ,For guests: There is a cafe down stairs and since buildings are attached you can walk to another one to get something.  The food is ok, not horrible.  You can also walk outside where there is a chipotle around the corner and some grill that I can't remember the name. ,Overall:  Everything was extremely clean and didn't have the 'hospital smell', it was nicely decorated too so you didn't feel like you were in a hospital.  If I ever get surgery or medical treatment again, HM will be my first option if possible.  The experience I had here was wonderful and I couldn't have asked for a better medical staff and place to get the surgery done.  I am extremely pleased and you will be too.",Houston Methodist Hospital
4.0,"This is a nice hospital.  They are excellent in what they do.  I have no complaints here.  If I was to get sick or in need of some help, this is the place to be.",Houston Methodist Hospital
5.0,"I really can't say enough about the staff at this hospital, you will find a group of dedicated professionals who really care about your well being. I entered this facility knocking on death's door. When I awakened from a coma 10 days after I checked into the Emergency Room, I felt I was treated with the same level of care as former President George H. W. Bush received when he was admitted for his medical issues. You can tell these folks really love what they do. I read some reviews about the staff being over worked and this may be true, but that's not their fault. Everyone ,from top to bottom made me feel that my recovery was a priority and that is truly appreciated. I don't always check into hospitals.... but when I do It's Houston Methodist Hospital. Stay healthy my friends.",Houston Methodist Hospital
3.0,"Pretty crowded. Most of he staff was quite helpful, but the environment made the situation with a family member a bit on edge.",Houston Methodist Hospital
4.0,"Dear Billing Dept,,Please send me ONE consolidated bill for my charges. Every month, despite calls to you telling me I have to call some billing company outside of Texas, I receive 8 bills with the same account number. Call me crazy, but this would end up having to be paid by an increase in patient costs if you mail 8 bills to every patient. Do you really need to spend 0.49 cents to bill me for 0.31 cents?!,We love your MDs, staff and have nothing but great things to say about your hospital. This is really poor customer service...billing is the weak link of an otherwise awesome hospital!",Houston Methodist Hospital
2.0,"I gave birth to my son here. The overall patient experience was a okay. Nurses were over worked and no proper post op instructions were given. The lack of information may indirectly lead to my son's hospitalization just two days after discharge. However to be fair it's just a speculation. Which really annoyed me is the billing department.,I pre-registered more than one month before labor and I even called to verify that they had the information. Guess what? While I was in intense labor, the phone in delivery room rang and asked for me. It was the billing office asking if I had insurance! WTF! Despite being very mad, my husband gave them the information. But it was not the end! Just a few hours after my son was born, the phone rang again! It was the billing office again! Asking the same thing! I thought I was crazy until I verified with the nurse. Yes they did call twice during my short hospital stay asking the same thing. Do you think that was all? NO! A few days after I received my son's hospital bill listing him as self pay. Billing ppl do you have any job training? Newborn is covered under mom for the first 30 days! To make us even more frustrated, a few month later they called us again saying that the insurance company hasn't paid them and we needed to pay. PLEASE! Billing people! It is your job to chase down insurance company! It's not like I have a random insurance I have BCBS!,I realize the administration at methodist will never read this review or care about my experience. If you have a choice, please go somewhere else. We had much better experience with children's hospital.",Houston Methodist Hospital
1.0,"I am so glad I canceled my registration at St. Joseph's for Methodist. The nurses in L&D are amazingly kind, caring, and attentive. Even the registration was a breeze. I'm looking forward to coming back for my ""longer"" stay.,Edit: The most condescending staff ever!!! Needless to say, they ignored my medical complaints and the issue got worst so I'm now changing hospitals in the middle of an emergency!",Houston Methodist Hospital
5.0,"We have had 2 babies delivered here, the best care, the best service, and the moat knowledgable staff I have had the honor of working with..,Love you guys and thanks for my angels..",Methodist Sugar Land Hospital
5.0,Staff is always friendly and parking is easy.,Methodist Sugar Land Hospital
4.0,"One of the nicest hospital's in Sugar Land. Free WiFi for guests of the hospital! Just happen to be here for a small corporate event and found myself admiring the friendly staff and people around. ,The care of some nurses at the hospital can be great, but of course be weary of some of the care other nurses provide, not everyone is the same.  ,It could use a better cafeteria and gift shop, overall the hospital is there for the patient.  The area surrounding the hospital gives you good choices on restaurant alternatives.,The heart and cardiovascular services of the hospital is excellent from the surgeons to the nurses (specifically in the ICU) and the equipment used on the patients are some of the highly advanced technical equipment to monitor the patients condition.",Methodist Sugar Land Hospital
4.0,"Came here to visit a patient that was staying here for a week. I thought that I wasn't going to be able to stay over night but the nurses said I could.  I've been to a couple of hospitals and this one beats all of the other ones.  This hospital is very friendly, great customer service, nurses and doctors. I would recommend this to any one.",Methodist Sugar Land Hospital
5.0,"You don't want to be in a hospital. But if life throws you a curve ball, this place is as good as it gets. I was treated here for pneumonia from Feb 6 to 22, 2010. I have been using the outpatient lab since last month. I was here on June 4 and then this morning. Shay, the phlebotomists drew blood both times. She is a very nice young lady. This morning I was going to give blood as well as a cupful of ""you know what"". Since I had been fasting, Shay brought me a bottle of water and let me wait till I was ready to fill the cup. Once we were done, Shay walked me out. I will see her in a couple of months.",Methodist Sugar Land Hospital
5.0,What a wonderful hospital. Nurses in the ICU and on the 4th floor are great! The staff here really knows what they are doing!,Methodist Sugar Land Hospital
5.0,"This review is for Dr. Hema C Patel in suite 530. I've been her patient since 2012.  She's a good listener and easy to talk to. She speaks candidly without being cold or scornful. If you have an issue, she's intent on getting you back on track which I love. Every time I see her it's like catching up with an old friend. I know she keeps notes like all other doctors but it seriously feels like a personal relationship with her.,Expect to see her within 30 minutes of your appointment time.  Her staff is friendly enough and runs her office efficiently.",Houston Methodist West Hospital
5.0,"I had a great experience here (great as far as appendicitis goes), and experienced fantastic accommodations and bedside manner at this hospital. All the nurses and doctors were competent and friendly and tried their best to make me feel at ease pre-surgery, which was fantastic. My doctor, Dr. Nguyen, explained the procedure of my appendectomy very thoroughly and clearly and my nurse Heather was so nice and understanding throughout the entire ordeal.,The facilities at this hospital are also top-notch. My room had a fantastic view and everything inside seemed very new and up to date. ,They took my health insurance, Aetna, without any issues. My appendectomy came out to a very reasonable price after my insurance paid for most of it. Thanks for saving my life without driving me into bankruptcy Houston Methodist West!! Keep it up!!",Houston Methodist West Hospital
5.0,"My good ol trusted hospital. It's usually clean, the staff is always on point and very polite. The nurses and doctors are well trained. I trust this hospital so much that after my first delivery where I want to delivery my second child here.",Houston Methodist West Hospital
1.0,"I went to this ER after passing out several times at work. The only thing that got me back to a room in a timely manner (in my opinion) is that I happened to pass out while they were doing an EKG in the triage room. ,I warned the tech who was with me that I felt nauseous and might pass out again, and she hurried looking for a bag instead of making sure I was safe. I pointed out the emesis bags on the wall and in a rude tone she said she knew those were there but wanted something else for me. That's the last thing I remember.,As I came to, someone was shouting that I was having focal seizures (what?! No history of seizures for me or my family) and to get me into a room ASAP. They slapped oxygen on me without a pulse ox and wheeled me to a room where a nurse told me to change into a gown. I took the oxygen off so I could change and forgot to put it back on. The nurse came back in and checked my blood pressure but didn't check my oxygen saturation. He didn't say anything about seizure activity and I was crying, thinking that I had some new neurological disorder so I wasn't thinking clearly enough to ask apporpriate questions. He told me a doctor would be in soon.,We waited about an hour and the nurse came back in asking if a doctor has been in yet. I said no and he said he would be right back. A nurse practitioner (or maybe PA?) came in and looked at my labs, asked me my symptoms, I told her I was taking a beta-blocker and she wrote that down. She started walking out saying my labs looked great but I was probably dehydrated. How does that add up?,The nurse was nice enough but when he came to attach fluids to my IV he had (what looked like) dried blood on his hands. I'm not sure if he washed his hands before entering the room, but he definitely didn't put gloves on when touching my IV which is my preference when I care for patients.,An IV bolus and a couple hours later I was discharged with instructions regarding dehydration. How could I be dehydrated when my chemistry panel and urinalysis came back normal? I went to see my PCP the next day and he said stop taking the beta-blocker immediately, that's what's making me pass out. Easy enough fix. Told me to rest for  a few days without work and I should be OK. Luckily I didn't take my beta-blocker that morning because I assumed that's what the problem was. If I had kept taking it I would've ended up back in the ER. Thanks for incorrectly diagnosing me, Methodist ER. Twice.,I will never return to this ER. ,On a positive note, the outpatient experience I've had so far has been great with the providers (not so much their ancillary staff). When I had an ultrasound done the ultrasonagrapher was friendly and proficient. I love my PCP Dr. Medrano and will continue to see him. However, since my ER experience was so bad I can't give any more stars on my yelp review. I filled out a survey they sent to me about a month ago and put my name and phone number requesting a call. No one every called me. ,Please don't go to this ER if your life is in danger, I'd be scared for you.",Houston Methodist West Hospital
5.0,Great updated hospital that takes good care of patients.  They recognize problems quickly and acted fast enough to really help out my family in the past.  I recommend it to family.,Houston Methodist Willowbrook Hospital
4.0,"We delivered our baby here by unexpected C-section.  Came in on a thursday to induce, delivered on a early Saturday morning and left on a Tuesday.  We had private rooms throughout our stay with an extra bed, the post delivery room was more comfortable than the labor and delivery room.,We had wonderful nurses and doctors in Labor and Delivery and in post delivery care.  Sometimes I wished that they would let us sleep instead of coming into our rooms at 2am to get our blood pressure and temperature.  I don't think I ever got very much sleep while there except while on IV pain meds.  My delivering doctor came in everyday to check up on us.  Nurses were kind and attentive.  ,Breastfeeding isn't always intuitive to mom or baby. They had 3 lactation consultants on staff at the hospital and they were super patient and passionate about the work they do there.  They came in everyday to check in on us too and spent a lot of time with us working on our latch and came up with inventive solutions to help try to feed our baby.  I am super grateful.  ,Tip:  You can rent a Medela Symphony breast pump from the gift shop downstairs for a 2 weeks minimum for around $35.  Totally worth it until you get your breast pump or latch to be consistent. ,Food - I was surprised at the range of food available to order.  They had quite the variety, a 3 page menu for non solid diet and then a 4 page menu when solid food was allowed.  Order about 30-60 minutes ahead and they deliver like room service.  I was usually busy feeding or sleeping so I never got to eat the meals while they were hot.  So that's not their fault.  3 square meals a day and then they had a nutrition room where you could go get snacks, juices and coffee.,I left after my 3rd day, wishing I could stay longer, knowing I wouldn't be able to rest as much as I did in the hospital.  The billing department made me feel uncomfortable on my second day there.  Someone from their billing department asked for my credit card number to charge $901 for my stay.  I thought that was odd and unusual but at the moment I felt I was uneasy also not paying.  Kind of like someone giving you the bill at a restaurant.  How do you not pay?  After giving her my CC number over the phone, I thought the amount she asked for was bogus as I spoke to insurance and Willowbrook hospital before admission and they only quoted my stay to be for  1/2 of that amount.  I panicked and wondered if I had given my CC number to a con.  It turned out it was the hospital and now my insurance company is working on getting the amount corrected.  ,Tip:  Have your insurance company talk to billing instead of handing over your CC number like I did.,Besides being shaken down by their billing department.  I had a good experience,  I felt the staffed was thoughtful and attentive to us and our family.",Houston Methodist Willowbrook Hospital
5.0,"Absolutely wonderful nurses - especially Nicole and Kristen! Kind, attentive, positive and knowledgeable. My doctor, Jeanne Smith, worked with my wishes for nearly 60 hrs to avoid a c-section. I had a wonderful birthing experience here.",Houston Methodist Willowbrook Hospital
1.0,"My father saw Dr Daniel Kelly a few hours ago. We went in to have him checked after reporting lower back pain and neck pain after a minor car accident a few days ago. Starting from his nurse, the doctor, and even the Xray tech, they were all unbelievable. These people weren't aware that my sister works in the medical field as well and after getting enough of their nonsense, she started questioning them and they started getting nervous with the questions. The Xray tech was obviously upset because she told him that he wasn't following some procedures. I am so glad that when dealing with health, we're able to request the right tests to be done and not be taken advantage of.",Houston Methodist Willowbrook Hospital
