rating,review,location
5.0,"Best hospital in Houston. Friendly Staff, nice environment and some of the best doctors. The place is clean and the outpatient building is quite new. Food here is great too.",Houston Methodist Hospital
4.0,"I agree with below poster, the best hospital food there is!  But, points off for being in a hospital.,My only qualm is that the soups are never vegetarian, and I always want soup.  Instead I have to go to the salad bar (boo hoo) or the dessert bar (woo hoo) or the endless lines of grills, sandwiches, stir fries, etc.,Too many ways to ruin your triple bypass...",Houston Methodist Hospital
2.0,"The selling point of this cafe is the variety. It's OK food for relatively cheap, and if you work late in the med center it's a staple of your diet. ,Soups never seem fresh, sushi isn't really fresh, the hamburgers and grill make what you want on the spot. The cornbread is NEVER fresh, but the deserts are usually good,Recommendations: philidelphia cheesesteak. greasy and tasty",Houston Methodist Hospital
5.0,"I was never a patient here, but I came as a New York licensed nurse on an Evidence Based Practice research conference recently and was absolutely amazed.  The facility is gorgeous.  Every single person I met was curtious and professional.  From housekeeping to the top administrators ---everyone made me feel welcome and they were willing to help me find my way around.  Cant wait to come back for another conference...and if I were ever to live in Houston I would definitly apply to work here.",Houston Methodist Hospital
5.0,"First off this is a review of the cafe.  This is by far the best hospital food I've had.  Their cafe honestly better than Luby's cafe food.  They offer a wide variety of selections from fresh to order sandwiches, a BBQ area, Asian Stir frys, Homestyle cooking meals, Tex-Mex stand, Pasta Bar, Pizza, Sushi, fresh made salads and soup, and a made to order grill.  But what makes this a 5 star is their desserts.  Their desserts are amazing!  The presentation looks like something out of la madeline.  I am willing to make the walk from work to this cafe.",Houston Methodist Hospital
4.0,great hospital- but i hate that the parking is so expensive! I prefer riding the train to the hospital when time prevails.,Houston Methodist Hospital
3.0,At least a 5 hour wait in the ER.... :/,Houston Methodist Willowbrook Hospital
1.0,"WORST ER EVER!!! I was recently directed by my OB to come here after vomiting for 15+ hours. I arrived at 1 am and by 530 am had still never seen a dr. I was put in a room for 2.5 hours and no one ever came to check on me. I was not clinically dehydrated upon arrival but after 4 hours of continuous vomiting in this ER I was severely dehydrated. I was told by the asian nurse that there was only one dr working the ER. WHAT????? After being in the room for so long my husband finally opened the door to the hallway to see what was going on. We could hear woman gossiping and laughing at the desk. He pushed the button to call for a nurse and the lady from admitting came in the room and asked, literally, ""what do you want?"" Why was she coming in? She is not even medical personnel! My husband asked for the nurse, when she finally showed up she was irritated to be there and very cold and curt. I begged for something to stop the vomiting and she coldly informed me that it was against the law for her to give me anything with out orders from the dr. I asked how much longer the dr would be and she responded that there were still several people in front of me that I would just have to ""deal with it."" I finally began crawling to get out of the bed and told her we would be leaving and going to a different hospital to which she responded that I should do what ever I wanted. When I put my shoes on and began walking out the door she began YELLING that she would call the police if I left with the IV port in my arm. (this was put in but never used, why???) I told her to call the police. She RAN out the door to go call the police. She was clearly more concerned about the port than my welfare. My husband convinced me to let her remove it and she beraded me the entire time. I have never experienced such treatment at a medical facility in all my life. When I reached another emergency room, my pulse was 117 and I was severely dehydrated. I required two bags of fluids and the dr was in shock that I was left so long without care. He explained that dehydration is very serious during pregnancy. I informed my OB about my experience and he said he has had 3 other patients complain about the care given here as well as other physicians. His entire practice no longer refers patients to this hospital. I will continue to warn everyone I know about this horrible facility. By the way, 2 years previously my husband came in to the ER in the middle of the day with complaints of chest pain. He had a heart attack one year before this. He sat in the waiting room for 2 hours before they ever checked his cardiac enzymes. We thought this was an isolated incident. Apparently, it is the norm.",Houston Methodist Willowbrook Hospital
5.0,"I had surgery in feb '11 at this hospital and I give a big thumbs up to the nurses and other staff I dealt with. , I stayed 9 days in the hospital following surgery and although I yearned to be home, the stay was about as pleasant as one could get for a hospital. The rooms are all private and comfortable including a full sized sofa which pulls out to a twin sized bed for overnight stays by family and friends, modern arm chair and side table, flat screen 27"" tv with cable and DVD players, private bathroom, and personalized menu selections for each meal delivered about 20-45 mins after ordering.  The hospital also provides free wifi which was highly utilized during my stay.,My room also had a huge knee to ceiling window with a nice view of 249 which made my room seem more like a hotel suite. , Again the staff and the nurses were very pleasant and such a joy to be around.  They all seemed to enjoy their jobs and aimed to please the patients.  I still remember my nurses names who I enjoyed the most; Shasha, Alyssa, and Mary Ann.",Houston Methodist Willowbrook Hospital
3.0,"I went to St. John for an outpatient surgical procedure.  I found the registration process to be simple and quick and the nursing staff to be friendly and helpful.  The facility seemed clean and in good repair.  Bright lighting and decor in the lobby and waiting room was a nice change from some other hospitals I have been in.,My procedure went well and recovery was quick.  The friendliness of the nurses in the outpatient surgery unit helped to make me feel comfortable.",Houston Methodist St John Hospital
5.0,Very professional. The MRI department does a great job.,Houston Methodist St John Hospital
1.0,"I was born at TMH in the med center 46 yrs ago and have been a patient there more times than I can count.  So when we moved to Clear Lake I assumed Methodist/St John's would be a good hospital.  ,I was wrong!  I had one of the worst ER experiences today.  No need for details.  Worst male  triage nurse I have ever met in my life.... After being a rude condescending unprofessional and a complete jerk to me in the triage.... he must have found my husbands pain funny because I overheard him laughing about my husband to the doc as the other nurse showed us to our room.,I will say our RN Amanda was fantastic'",Houston Methodist St John Hospital
3.0,"i went to the ER on a wednesday around 8 pm after falling 10 feet while bouldering and injuring my arm. my friend pulled up to the front door to walk me in and an off-duty nurse who was clearly heading home from her shift told us we needed to enter through the ER which was on the opposite side of the hospital. i was in a lot of pain so she offered to wheel me there--a 10/15 min walk. she spoke to me and kept me calm the entire time and was just wonderful. thank you, Laura!,the ER was empty except for 2 others. i went right up to the registrar which was kind of an awkward experience bc she's asking for all this info while i'm crying in pain. plus she asked me what my social security number was and there were other ppl well within hearing distance so that made me uncomfortable to have to recite it out loud. i didnt have my wallet with me though so it was kind of them to admit me immediately despite no insurance card or id.,i ended up waiting over an hour until i got some pain medicine for a broken arm. nurses and X-ray techs came in and out throughout that hour but they kept telling me the meds were coming, the meds were coming. when the shot of morphine didnt help, i had to wait another hour until they gave me an iv drip--the entire hour before, i was telling them i was still in a lot of pain. also the payment collector person came in even before i got either of those medications, so it was just frustrating to be told i needed to pay $500 upfront and i hadn't had any sort of treatment yet/no one had seen me.,overall, the entire ordeal took over 5 hrs, which is to be expected at the ER i guess. i didnt mind being there for 5 hours, i just think timeliness and the order in which things happened could have been better. the staff was fine though, nice in their exchanges and informative. the X-ray techs---mike, levi, and carlos---were very accommodating as i had trouble shifting to the X-ray table so they offered to take the images from my hospital bed.",Houston Methodist Willowbrook Hospital
5.0,"I'm not writing as a patient, but as a guest I give the place five stars. Every single one of my relative's nurses and attendants has been fantastic. They are friendly and they never rushed the patient. They also treated her with the dignity and respect that she needed when she was in a vulnerable state.,Every employee that I encountered had exactly the right attitude and was sympathetic towards guests and patients. The first person i talked to walked me to where I was going when I asked for directions,  even though that probably wasn't part of his regular duties.,One other thing-- the cafeteria/food court is five stars for variety, food quality and pricing.",Houston Methodist Hospital
5.0,"Largest and greatest variety of cuisines I've ever seen in a hospital. Shouldn't be surprised considering TMH's size. ,Great food; try the salmon as it's ALWAYS on point! ,Some of the valet guys, eh hit or miss. Some nice, others in DESPERATE need of some customer service training.",Houston Methodist Hospital
4.0,"I'm fairly familiar with The Methodist Hospital.  My grandmother was a patient in the early 90's, I worked across the street in Scurlock Tower for a few summers in my high school days, and most recently my mom was a patient.,It seems that the hospital is aware that not everyone is there for happy times, like childbirth, and great care is taken to allow people to be at peace.  There are places for people to pray and worship regardless of their religion, and there is a beautiful garden where people can meditate or just be alone.  I was able to stay overnight in my mom's room with her on a pull-out chair that laid flat and wasn't as uncomfortable as I anticipated, and the nurses gave me linens and pillows.  Additionally, the cafeteria has good food and it's not overpriced.  I realize people don't hang out at hospitals for the food, but when you're there for an extended period of time, it's good to know you don't have to venture far away from your ill loved one just to grab a bite to eat.,However, I had two frustrations: the length of time it took to get my mom from recovery to an actual room, and the length of her bed in her room.  Since check-out is at 11am every day, you'd think the empty rooms would be cleaned and prepped by 4:30pm when my mom was technically finished with the recovery phase of her surgery.  Nope - three hours later, she was finally wheeled into a room.  Every time the nurse in the recovery room called to the nurse's station on the patient floor, they said it wasn't ready yet.  Also, my mom is 5'9"" and the bed seemed to be meant for the pediatric unit.  She had to crumple up her legs in order to fit them in the bed, but she wasn't able to turn onto her side to sleep.  Eventually, (five hours after the first request with several other requests in the meantime) she was given a bed extension so she could lay down like normal.,Overall, I think The Methodist Hospital is great, and should I find myself in Houston in need of medical attention, it would be at the top of my list for places to go if I had the choice.",Houston Methodist Hospital
5.0,"After spending more than 84 days in this place I think I have a pretty good feel for the place.  The staff here is amazing, everyone from transportation to housekeeping were always so nice to me.  The nurses and doctors were amazing, and they  saved my life.  ,I found the hospital easy to navigate, friendly staff members everywhere and after you do it once or twice parking is really easy.",Houston Methodist Hospital
5.0,"This is mostly a review of the cafeteria, but this really IS ""as good as it gets"" for hospital food.  I haven't had a single thing I didn't like.  You really can't go wrong.  Their desserts look fabulous too.  Everyone raves about their bread pudding.  They are busiest from 11-1, but the checkout lines move fast.,On to the hospital...  Fortunately for me, I've never had to be an inpatient at a hospital. *Knock on wood.* But if you have to go to the hospital, you can't go wrong with Methodist.  They are awesome.  I'm a student nurse here, and it beats the other hospital I was at last semester, which shall remained unnamed.  You will encounter the occasional person who probably should not be in that profession, but that happens everywhere.  Don't let that keep you from coming here.",Houston Methodist Hospital
4.0,"Thanks GOD I have never actually had to visit as a patient...not to say that they don't have some of the best doctors in the world working here, because they do. But I have been fortunate enough to enjoy good health. ,I visit Methodist because the GREATEST neurologist works here...and I get the pleasure of picking her up from work every now and then!!!,With that said, Houston is the best place in the world to get sick!!!",Houston Methodist Hospital
5.0,"Came in with my Mom due to her having back pain. Staff has been fantastic, even though I am not the patient My Mom's nurse brought me a warm blanket (fresh from the drier) and everyone has been respectful and kind.",Houston Methodist Hospital
5.0,Methodist hospital is a wonderful hospital..If you have to be in the hospital no place better. The staff and the doctors are the best. It is a beautiful hospital very serene setting in the lobby. They tend to your every need. Very friendly staff on all levels.I wish everyone reading this good health but if you have to go to the hospital you will feel very taken care of here.,Houston Methodist Hospital
5.0,"Great hospital with a great staff. The MarketPlace Cafe (their cafeteria) is pretty amazing considering it's hospital food. I would by no means come here specifically for food but if you work here, then you don't have it so rough. With a make-your-own-salad bar, a plethora of mini desserts (MY KRYPTONITE), and a pretty good home cooking station, there's something for almost everyone. I also respect that the cafeteria makes brown rice sushi, that there's a Starbucks in the lobby, that it has a Mariott Hotel, and that they have a volunteer who plays the piano beautifully for people in the lobby. It's been on quite a few lists for best oncology, pediatrics, cancer treatments, and many more. ,Overall, a great hospital.",Houston Methodist Hospital
5.0,"The staff is very helpful, alert, and happy.  I'm very confident knowing  Methodist Willowbrook is the hospital closest to our home.  Having first hand experience with the ER I'm happy to say we were quickly attended to.  Granted, it was heart issues, but they acted professionally and quickly.  I can't say enough good about this facilty.  The communicaiton between staff is exceptional.  It is a customer service centered facility.,Only negative needing improvement is security at night , it's not that comforting nor visible.  I think there could be more night security both in the parking lot and common areas.    Hopefully security camera's are in place and working.  If you leave the building at night the only way you can get back in the building is via the ER entrance.",Houston Methodist Willowbrook Hospital
4.0,"The Methodist Hospital Cafeteria is very good! There are lots of options from Asian stir fry (with spring rolls and egg rolls), grill station (burgers and fries), salad bar, pizza, pastries, desserts, and more! It's a wonderful selection for hospital food... but don't be fooled, it is still hospital food!!  ,Today I had some fried rice and it was gross.  It had been soaked too long and the rice was all mushy. The egg rolls are ok. The chicken sandwich was ok and cheap! The fries were not worth getting.,The soda machine was down, so you had to purchase bottled soda or tea.,It's good as far as hospital food goes. It's just not 5 stars compared to food outside of the hospital.",Houston Methodist Hospital
5.0,Beautiful and clean hospital. My sister had all 3 of her kids here and I had mine at the Willowbrook location. Methodist hospital is the best hospital in Houston.,Houston Methodist Hospital
4.0,"Two scary experiences had led me to the Methodist Hospital. ,My 1st was for endoscopic thoracic surgery, where the surgeons work closely on my spine...to me that was nerve-wracking. And actually, the doctors were really working on my nerves, literally. I have hyperhidrosis, an overactive nervous system where my hands, feet, and armpits would excessively sweat. Thanks to the wonderful Dr. Garza and his special team, my hands and armpits are no longer embarrassing me (as for my feet, well that's another story and perhaps another surgery another day)!  To sum it all up in simple terms, the doctor removed the ganglion nerves from my spine between thoracic bones T3 and T4 and replaced the nerves with tubes. And voilà presto!!!....sweat be-gone!,My 2nd experience wasn't so great. I had a really bad and very rare reaction to some medication I was taking, which led me to my 7-day stay at this hospital.  I had to deal with a large team of various doctors: dermatologist, endocrinologist, oncologist, internal medicine, cardiologist, etc. Nobody knew how to deal with me or my symptoms. When I was in the bathroom, I had suddenly turned dark purple all over. My mother panicked and pulled the emergency cord. Nobody came! She pulled it 2 more times and still no attention from staff!!! She ran out to get help. I was soon given morphine and felt really good after that! ;) To make a long story short, I was given special skin cream and strong steroids and the problem went away on its own after months of waiting on the meds to flush out of my system.,The only positive thing from that horrific experience was meeting a great oncologist, Dr. Foote. He's funny, patient, caring, and knowledgeable. The other doctors weren't so patient with me and weren't so friendly to this suffering patient.,The meals served (and even the choices available) each day were actually okay for hospital food.  Also, the cafeteria food was tasty too. My mother kept telling me how much she loved the burgers from the cafeteria and would often get them during her visits.",Houston Methodist Hospital
5.0,"Best hospital in Houston.  Will not change it for anything. I live in the east side, and still manage to go to med center Methodist instead of the Methodist in Baytown. Mrs. Debra in the ER is the bomb. I was there 5-28 bymyself and she was so kind and sweet. Even gave me a hug. :) ,My granny has been going to this hospital for almost 40+ years. I have had 3 of my 4 bb's there. Love it. :)",Houston Methodist Hospital
4.0,"Great Hospital, crappy parking....",Houston Methodist Hospital
5.0,"This review will cover the facility, staff, work, experience and the cafeteria.,I've had some of the most memorable and rewarding experiences working at this hospital.  Each and every nurse and surgeon I worked alongside were highly knowledgeable in their focus as well as enthusiastic about their positions there.  One would feel the same way over the great benefits, good coworkers and the hospital's #1 goal for patient and employee satisfaction.,I worked in the operating room for orthopedics, neuro and general cases.  Everyday was a rewarding and educational experience.  The facilities were always clean, sterile and every nurse and surge were attentive to the case at hand.  Every patient left happy.,The building(s) itself is beautiful.  You're welcomed by high cathedral sky-light ceilings, a tranquility fountain, marble floors and a musician at the baby grand piano.  It's very inviting to families waiting or worried about their loved ones being tended to.  Plenty of lounging area.,The cafeteria can't be beat here.  Personally I think it rivals top college cafes like UCLA.  Several stations hone different international cuisines.  Everything is prepared fresh in the many exposed kitchens.  Many of the menu items are made to order as well.  I've never had one bad meal here.  ,The medical staff is the best.",Houston Methodist Hospital
5.0,"This is definitely one of my weirder reviews, but hey I'm weird.,First of all the ER is pretty quickly. I was there twice in a span of a week, and both times my time in the waiting room was under 15 min. The intake process involved less paperwork than expected. I was in and out of the hospital in no time.,The nurses were blunt as expected, but they were quite respectful, and didn't treat me like a complete idiot. They were helpful with all my questions. ,The care was good and all but I feel like this review is more about the food. It was kind of an obsession during my stay there. I think it's partially because I'm a college student, and hadn't eaten a decent meal in weeks. Actually it was pretty tasty by any cafeteria type standards. Again, college student eating in an absolutely horrific cafeteria. During my stay they would give you a menu each day with some pretty good choices, but I was pretty sick of jello by the end of it (and I didn't think that was humanly possible!). The actual cafeteria has a great variety and worth eating at if you find yourself in the med center.",Houston Methodist Hospital
5.0,"Heart problems run in my family.  I guess its just the bad heart gene passed down on my father's side.  I have had Atrial Fibrillation (rapid heartbeat) for over 20 years.  I have gone to Cardiologist after Cardiologist from Tyler, Tx. to Texas City, Tx and to no avail could anyone get a handle on slowing my heart rate to a normal sinus rhytum.  I would get a Cardioversion (electrical shot to the heart) and my heart would take a regular rhythum for 2 or 3 days and them BAM, it would go right back into Atrial Fibrillation.  Doctors loved to ""medicate"" me.  I've tried just about every heart rhytum medication known to man.  Then one day while in my Cardiologist's office in Texas City I saw one of his associates, a Doctor Seabolt. ,This is where my life takes a right turn.  Dr. Seabolt told me of an Electrophysiologist (they work on the electrical part of the heart) named Dr. Nadim Nassir.  Dr. N. Nassir is with Willowbrook Cardiovascular Associates and has an office in the Medical Center in the Scurlock Tower.  He operates out of the Methodist Hospital right across the street.  A walkway over Fannin connects the two buildings.  I started seeing Dr. Nadim Nassir and kicked my regular Cardiologist to the curb in Texas City.  I have been seeing this man for under 6 months.  He covered the regular gauntlet changing a few medications and 4 different Cardioversions.  A little over a month ago he changed me over to Amioderone and issued another Cardioversion.   IT WORKED !!!!!!!!!!!!!!  I have now been in regular sinus rhythum for over a month now and I feel so much better.,I cannot reccomend Dr. Nadim Nassir and Methodist Hospital highly enough.  They have literally changed and extended my life for the better.  The professionalism and the expertice that I have been surrounded by at this hospital has been amazing.",Houston Methodist Hospital
5.0,Wonderful hospital. They took great care of my mom and the after care and constent follow up they have given her is second to none.,Houston Methodist Hospital
5.0,Excellent patient care and top doctors!,Houston Methodist Hospital
4.0,"Who loves hospitals enough to give them 5 stars?  Not I.  But I will give Methodist 4 stars.  Came here to do an outpatient procedure at the blood bank.  Dr. Leveque who is the director of the blood bank is nice and warm and makes you feel as much at ease as possible during these things.  The entire staff seemed courteous and professional, and though my experience has been limited to just this department and just these few people, I hope they justifiably reflect the rest of the Methodist staff.  The lobby area is comfortable and has a Starbucks in case you need to run away for a little while.  (Just kidding.  Not really.)",Houston Methodist Hospital
