rating,review,location
5.0,"My father-in-law has unfortunately been here for more than three weeks, but the silver lining during this time is the AMAZING nurses who have taken such good care of him. Having gone back and forth between ICU and a regular room he has encountered several nurses between floors but no more who it is each nurse has been so attentive to his needs. They work tirelessly around the clock and no matter what time of day it is, each person has a pleasant smile. Those that come to mind that have stood out for me are Amy in ICU, Alphonso, Donnie, and Teria. ,I hope no one ever has to go to the hospital but if you and come to Willowbrook Methodist Hospital, you will be in great hands!",Houston Methodist Willowbrook Hospital
5.0,"After a horrible experience at North Cypress Medical Center (see separate review), my sister took my 87 year old mother to the emergency room at Houston Methodist Willowbrook Hospital.  The doctors and the staff were great.  My mother was in the hospital for 3 weeks and everyone was so kind and caring.  I was there everyday while she was in the hospital and cannot say enough about the good care she received.  My father was a doctor and we are familiar with good and bad care and we definitely appreciate all that they did to take care of my mother.",Houston Methodist Willowbrook Hospital
3.0,"I had to take my mom to the ER several times in the span of August-October of Last year for varies reason. I have encountered some questionable situations about their ER section. It seems like the staff who work the front desk could careless about your entrance. I can't say this is everybody, but it was the ones I was there those months. Of course, my mom went through some things that needed immediate attention. I am Very disappointed with the front desk staff. There have been several occasions where I took my mom in and NOBODY even acknowledge that we are waiting right in front of them. In fact, there was a manager at a computer desk doing some paperwork, not even caring for people walking up to her. She doesn't even look up. Seriously, if you're going to sit at a computer, let alone at the ER section of the hospital at least show some concern for your patients. I witnessed some people in great pain and they said their wait had been all day! Front desk knew about it, but didn't offer anything to comfort them. Unfortunately, they take patients based on severity, even if you arrived hours before a person with the greatest need. Which I can understand, but how can you measure that equally in all situations?!? Anyhow, once you get passed the ER desk to the back there are extremely caring physicians.",Houston Methodist Willowbrook Hospital
4.0,"This was the place that I spent most of my nights and weekends at for this year. I was here for 13 weeks straight because my grandmother got sick. She came in with pneumonia and came out with a pacemaker and kidney dialysis.  In the first part, we went to the ER. The ER doctors were finally helpful. They seemed nice and attentive. We had gotten Dr. Caspers again. He recognized my grandmother from years ago and spent the whole entire day in the ER waiting for a bed on the 5th floor. The nurses on the 5th floor are hit and misses. I understand that most nurses on the floor have 4 or 6 patients that they have to tend to but I don't think elderly patients get any love especially the ones that don't speak well or understand English for example my grandmother. Plus, I remembered there were other patients in the other room that the nurses had to yell at or one patient kept hitting the call button to get help but no one came to help.,Among all of the my grandma's nurses and doctors (trust me, she had so many during the morning and night shifts) I had to file a compliant against one of the nurses because she was rude and racist. I just felt that she is in better hands with the nurses and doctors. Plus, that is what nurses in the hospitals are supposed to do which is take care of their patients right? But us being there was to give my granny comfort and letting her know that we are there for her but it was putting a strand on my marriage since my husband would take care of my grandma in the day time, I would go after work until late or even sleep at the hospital. So, I had asked her nurse to take care of my granny because I just need a day to relax in my house on a Saturday since I haven't been home in months. She had the audacity to say, ""Ugh, how am I going to talk to her even though she (my granny) can't understand me"" I told her nicely that my granny can understand you and she can speak. It may be broken English but she can speak. I found that very rude because this hospitals have translators that the nurse could have called plus, I told the nurse that I don't live that far and she can always call me since my number is plastered on the walls.,Oh! Also!!! With non-speaking patients, please beware of some of the nurses that will try to get some kind of pills that aren't supposed to be in their system to knock them out. That has happened to us twice when I demanded to speak to the charge nurse and figured out why my granny received the meds. I saw it in front of me with my eyes when I specifically told a nurse not to give it to my granny and she went behind my back and did it. So, if you are able to spend time with your love ones every day, I recommend you that you should ask the nurses what kind of pills is your love one taking and remember it. Because the patients with no voice (can't speak English) can't talk for themselves.,Besides that few nurses we've had encountered, we spent many times in the ICU and NICU on the 3rd floor, the regular rooms on the 5th floor and 7th floor. I have to admit that the nurses on ICU and NICU are so awesome! They saved my family. The nurses kept telling us that we didn't need to go there and they will take care of my granny. My mother and I was able to get few great nights of sleep. There are also a few of the nurses on the 5th floor and 7th floor that are great as well.  If I could, I would name all of the nurses on here and the personal assistants.",Houston Methodist Willowbrook Hospital
1.0,"I'd give a negative star rating if I could for the ER.  I went in with a suicidal crisis.  They immediately put me in a room, took 4 vials of blood, the Dr asked me why I was there.  I explained I have C-PTSD--she had to question me multiple times what I said and what that was.  I swear she Googled it when she left.  They left me ALONE WITH NO TREATMENT OR CHECKUPS FOR 11 HOURS!!!!,Oh yeah...the only thing they did give me was 2 potassium pills.  I had to self medicate myself for anxiety.",Houston Methodist West Hospital
5.0,"Best  service ever! The staff of administration , the nurses the doctors. They kept us informed the whole time. My daughter had a bad case of strep and had her tonsils removed. I can't say how thankful as a mother the level of care she received. They were attentive. You can tell everyone loves there job!",Houston Methodist West Hospital
1.0,"WORST ER in the Katy area!  I brought my mom in because she is diabetic and had an infected toe.  They had her wait for 2 hours without even being triaged!  Mind you, it's a serious thing with injured, infected limbs on a diabetic but apparently they didn't think so or care.  She was getting tired of sitting there as something needed to be done right away so we left and called her on-call doctor.  He told us to go to the ER at Memorial Hermann Katy IMMEDIATELY because it was an EMERGENCY and she needed to be examined.  Well that is what we did and low and behold, the infection had set into the bone and they ultimately had to amputate her toe.  Had we waited around for Methodist to look at it, the infection might have gone further down her foot.  The ER here is a joke!",Houston Methodist West Hospital
1.0,"Waited for 50 minutes with my son in the E.R. who had a 104.5 fever and was never even called upon.  Had multiple people checked in before us who came in after us.  Took my son up the road to North Cypress Medical Center and was checked in within 5 minutes. Nurse walked in immediately after we entered his room and doctor was in within 5 minutes of that.  The longest we had to wait was the 15 minutes it took to get the lab results back that he indeed had the flu.  From the time we walked in to when we walked out was 45 minutes.  Not to mention the entire staff was AMAZING.  DO NOT WASTE YOU TIME AT Houston Methodist, go 5 minutes up the road where you will be truly cared about and taken care of.",Houston Methodist Willowbrook Hospital
3.0,"ER ROOM ONLY REVIEW: Unless you need stitches or are having a very very severe emergency please bring a book, crafts, iPad, DVD player etc...and get ready to wait a very long time. On the flip side, they offer free wifi! Please parents: bring something for your kids to keep them busy and occupied. Also, bring lots of sanitary wipes for the filthy seating. I do however like the staff that I have encountered and they all seem friendly enough.",Houston Methodist Willowbrook Hospital
5.0,"Cut my finger in half making an apple pie. Went &, only had to wait five minutes to be seen. Both nurses and doctors were very friendly. I couldn't have imagined it going any better",Houston Methodist Willowbrook Hospital
4.0,"Nice and clean and newly renovated!  Had my baby boy here during Thanksgiving 2012 and lots of helpful folks working there.  The nurses that took care of me were wonderful and always made sure I had what I needed.  Could not have been in better hands.  The Women and Children Pavilion is definitely state of the art and just feels that you can have your baby there knowing how clean and new it looks and not worry about some drab old hospital feel.  :),I was told the food in the cafeteria was good according to my hubby who ate a few meals there during my stay.  ,Thank you!",Houston Methodist Willowbrook Hospital
4.0,"My mother was admitted there last Friday through emergency due to having problems with her heart. Overall, based on her perspective and mine, the nurses were phenomenal! They had Really good bedside manners, very attentive to your needs and really fit right on in with the family. However, one of the cardiologists, Dr. Vivek were VERY rude. Actually, he was quite the opposite of what the nurses were. He was condescending, unprofessional and lacked any bedside manners. He blew off the nurses and our request to meet with him about my mom's specific situation, and his attitude was as if we were not supposed to ask questions. ,Overall, this hospital seems like a good place to be when you're ill. It's scenic with their garden and humanless playing piano in the front to welcome you. There are many quiet areas to wait in, and the parking is free! The food is not bad either, and they even have their own Starbucks inside, but beware of the slow lady they have working there; seems she's been with Methodist since they first opened. ;)",Houston Methodist Willowbrook Hospital
5.0,"My wife just had surgery here, actually just released on Tuesday afternoon from being there since Friday (8/22).  I really don't know how to express my appreciation for this hospital and it's Angels.  From registration to surgery to nurses to signing release forms....everything and everyone was very helpful.  We were treated as a part of their family, made sure my wife was comfortable at all times, even I was asked if I needed anything every time!  And I wasn't even the patient!  My wife and I were also very very pleased with our Urologlist, Dr. Thomas Hoang.  Every morning he would come in to let us know what he wanted for us and what his thoughts were on the healing process.  Outstanding performances from our Doctor, Nurses and the whole hospital crew!",Houston Methodist Willowbrook Hospital
4.0,"Needed to attend the Sports Therapy Section for my son...,... injuries aside, everything went well here. The staff is always helpful and always willing to help you do what is needed to get processed into appointments, help you during them, and get you out of there when you need to.,  This is the same therapists that will help you recover and any of your local sports figures from the: Rockets, Texans, Astros, or Dynamo.,  Good place to heal and get stronger, and a good place to know you are taken care of.",Houston Methodist Willowbrook Hospital
3.0,"Security? Security?,So, my cousin had baby #4 here and I stopped by to visit. The baby area is super confusing and there is a lack of security...anywhere in the building. ,The pluses are the nurses in the delivery/baby area are super nice and attentive. Her room was a good size and confortable enough. My cousin said she was happy with the experience and this is the 3rd baby she has had here.,Back to security, after putting in a few day visiting, her friend Ruth and I left around 11:30 pm. There was no one in the front of the buiding, and the theory is once you exit, you can't come back in unless you go through the ER. But the part they don't tell you is that someone will prob let you in. Which is how her friend Ruth got in after 9 pm. I think there should be more visible security. Just saying....,Overall it was an ok experience, it is a hospital. Keep in mind, that my review is based on being a visitor and not an actual patient :)",Houston Methodist Willowbrook Hospital
5.0,"Nice and clean hospital. Doctors and nurses are all very nice and caring. I had both of my boys at this hospital and they took good care of us. ,Call me crazy but I actually like hospital food here!!! ,I've been to the ER twice. Both times I was here all day but they took care of me and I felt better after I left.",Houston Methodist Willowbrook Hospital
5.0,Had a MRI on my hip. Go in and out fast. I had to take my ring off during MRI. Nurse took it and didn't steal it. Staff was nice and prompt.  Schupp sports medicine dr fantastic.,Houston Methodist Willowbrook Hospital
4.0,The Women Center is very amazing!,Houston Methodist Willowbrook Hospital
5.0,"I love how friendly and helpful everyone is in this hospital. WiFi service works well down some of the hallways where services cannot connect. Cafe was delicious and very reasonably priced.,There is a sort of energy about this place I absolutely love and admire when my family seeks treatment here.",Methodist Sugar Land Hospital
1.0,"Went in yesterday for dehydration from the flu while pregnant. The first nurse that put in the IV needle told me I was going to feel a feel a prick. I wasn't worried as needles do not scare me nor hurt me, but for some reason this time it was actually very painful and I said something to her. She just looked at me and said ""oh"" I then mentioned my throat has been severely sore for a week, the nurse looked in my throat and told me she didn't see any puss so she didn't take a swab to test for strep. Sure enough that night while I'm sleeping I'm struggling to pass air through my airway. I go to my trusted Methodist in Katy and immediately they took at swab for strep and was very confused why the hospital yesterday didn't run a test. My tonsils were swollen, my uvula was swollen, and my lymph nodes were swollen. I felt like all of this could've been avoided if the nurse wasn't being lazy at Sugarland. My current ob delivers at the Methodist in sugarland but I will switch ob to not deliver here and to deliver my second child at the Methodist in Katy. Also my arm is bruised where the IV needle was. Thanks.",Methodist Sugar Land Hospital
4.0,"A friend of mine was here having her baby girl a couple of weeks ago and I was in the labor and delivery room helping with delivering the baby, where I had a good 10+ hours worth of experience with the superior patient service.  Why was I part of the baby delivery?! Oh well, thanks to the husband/ father's a bad fear of blood! Lol.  Anyways.....So, everyone working in and around the hospital, from front desk receptionists and security officers, to nurses and physicians, was friendly, helpful, professional and accommodating, and everywhere seemed clean and highly sanitized. The hospital building was huge and the patient rooms were pretty spacious. Food service was not bad at all!  The meals were served promptly in big portions, looked all colorful (with lots of veggie) and nutritious, and tasted fully legit (just a tad bland) according to the new mom.  The hospital's food service team must have been working hard to drive away the stereotype of nasty hospital food! muahahaa.  The gift shop located right by the front entrance was such a cute lil' place to shop at!! The stuffed animals, the baby corsages, OMG all were adorbs!  Gladly, the new mom and the newborn were discharged 2 days after the baby's birth, going home all healthy and happy.  And now, I am a new Godmom! Yay!",Methodist Sugar Land Hospital
5.0,"This is very first hospital stay experience but I was very impressed. I've been in the medical industry and have done clinical rotations in many many hospitals so I'm very familiar with it...but I've never been an actual patient until now. I visited Methodist for a tour months ago and was impressed with their fast and friendly service and standards. Nice huge birthing suites. New hospital so very clean and beautiful. Highly recommend staff by my Ob Gyn who actually has rights to memorial Herman too but prefers here. I was induced here and every single person was pure sweetness, friendly, helpful and fast. From the nurses to the housekeeping staff, they made sure I was comfortable and happy. I was well taken care of 24 hrs a day (I had complications during and after birth) & I couldn't have been more confident of the staff to care for me & my little family. I highly recommend this hospital to everyone. I was here tues-fri and didn't want to leave! It was kind of like a hotel. There's also a Starbucks on site. Room service food is pretty decent but again very friendly. 2 thumbs up Sugar Land Methodist!!",Methodist Sugar Land Hospital
5.0,"I was refered by Urgent , the ER. They made admitting efficient as possible. Rearranging beds to fit me in. I landed in cardiac floor. I'm not a cardiac patient but this was a fab room. I got a very unexpected diagnosis of a neural sheath tumor. I'm a closet smoker.not good. ,But the nursing staff and in particular Joanne (sp) tolerated me. Even amusing me...they were very professional even when i wasn't., The only complaint i have...the vending machine in ER lobby does not accept $5 bills as it claims. You are reduced to the cardiac menu. Which really is pretty good. ,Upside... they actually remind you to order if you're medicated and forget. johanne paid that close of attention. Its a lovely facility but at the end of the day when you get stunning news i hope youre at Methodist sugar land...4th fl ask for room 409 and joanne! She deserves the Daisey award.,Please excuse editing",Methodist Sugar Land Hospital
1.0,The most terrible customer service I have ever received in a medical setting. The pre registration team is rude and utterly incompetent. I had an imaging appointment scheduled. They cancel it without consulting me. The gentleman performing the registration had no idea what he was doing and put me on the phone with an extremely rude woman who cannot explain to me without being completely rude and raising her voice why I cannot have my imaging done. Shame on you for treating your patients this way.,Methodist Sugar Land Hospital
5.0,"I initially took my father to Memorial Hermann Southwest and even though my father was in a lot of pain, they made him wait for a little over an hour which I think was BS especially since the staff thought could be experiencing a minor stroke. Running out of patience, we decided to go to the ER at Methodist and from that moment on, Methodist will be the first choice for my family medical emergencies!,As soon as we got to Methodist, the staff brought him in right away and started taking his vitals, blood tests, and ordered for a CT scan. Because it could potentially be a minor stroke, they immediately admitted him that same evening to keep close monitor on his condition.,From the minute we arrived to the minute we left, we were provided with world class services -- exceptionally excellent -- caring doctor, to nurses, to assistants, to staff members. We truly appreciate what you all have done for my father and his stay at Methodist.,Given that it's a hospital and certain things (such as medications) that was needed wasn't readily available so it extended his stay time, however, they were apologetic and made sure my father was as comfortable as possible.,On the last night of his stay he had a nurse by the name of Nanaya M. and she was very detailed with his medications explaining what its purpose and helped us understand his condition. She was always smiling and sparkling conversations which to me makes everyone that was on edge feeling a little at ease. She is the true definition of customer service and if anyone is lucky enough to have her as your RN, it will make your hospital stay just that much better.,All in all, I would definitely recommend my friends and family to Methodist in Sugar Land.",Methodist Sugar Land Hospital
2.0,"The more I go to this hospital the less I like it!! From them abandoning me during my delivery and giving me ZERO breastfeeding guidance and advice, to getting charged a  $10 late fee for a breast pump, when the agreement clearly says that if you don't return it, they'll presume you want it another month and charge your card another month, up to 3 months.,So I figured they'd charge me another month (which is what I wanted).  They called and told me they needed my credit card information to charge me another month, i went in, they charged me the two months PLUS a 2 day late fee!!! Furious! ,The more I use this hospital, the less happy I am with it.  Let's also not forget the administrative nightmare every damn time you call or attend.  They all want the EXACT same information, EVERY time - surely you have it after the first 200 trips?????? ,Methodist is also markedly more expensive than Memorial Hermann - if your insurance covers it, go down the freeway a bit - much better experience!!",Methodist Sugar Land Hospital
5.0,Love it close to home. Great docs.  Great cafeteria. A place where any top doc would love to practice medicine. They have a gym for employees.  Volunteer services help when your lost or need a wheelchair ride.  They have tons of expansion going on at this hospital.  Both my kids were born here and we loved the service my wife got and she would not want to deliver in any other maternity ward.  They have a gift shop next to the Sweetwater pavilion entrance where you can purchase a gift for a loved one who is ill.,Methodist Sugar Land Hospital
2.0,"The Breast Center sent me a letter stating that my mammogram showed I needed further evaluation. I never got the mammogram!!!!  I refused it in fact. I did get a breast ultrasound and got the results from that in the same letter. At the time of my ultrasound, Dr. Phillips (radiologist) asked me about refusing the mammogram, I told him I got a thermogram (noninvasive, procedure that looks for hot spots) he laughed, yes he laughed. I also see a breast specialist to take care of my high risk status. I felt angry that my personal choice was not respected. I called Maria, head of the Breast Center and she was very nice. She looked into my complaints and she talked to Dr. Phillips. She called and apologized for  Dr. Phillips. I guess he was too busy to apologize himself.  ,The letter bothers me as it appeared to be computer generated, with the default being the patient has as problem. I am sure I am not the only one getting alarming false reports.,My trust in traditional medicine just took a major hit. ,I refused the mammogram based on the fact that exposure to radiation increases the risk of cancer and regularly using radiation to look for cancer is crazy as it harms many women while helping some.",Methodist Sugar Land Hospital
5.0,I just got discharged from a 4 day stay. I was brought here due to a urgent care visit for severe stomach pain. This turned into something that one of the Physicians here actually caught. I had the procedure and was treated wonderfully by the staff here. The nursing staff was absolutely amazing very attentive and professional. My room was huge very clean.  This is my families hospital and I  so Thankful my condition was caught it been undetected for months.,Methodist Sugar Land Hospital
1.0,"Poor service and skill level. Not one nurse could place an IV in me the 5 days I was there. Respiratory attempted an ABG and gave me thrombopheblitis.  If you need real medical go to Medical Center!! Only positive was Dr. Shah with pulmonary, he is knowledgeable and very nice!!",Methodist Sugar Land Hospital
1.0,"Here, we have another healthcare organization pulling one over on their patients.,When I visit with the doctor my assumption is when I pay my co pay, I am fulfilling my financial obligation for that visit.,No so. This organization is fine with tacking on charges I had no idea I would be paying for. The doctor not the lab person mentioned anything about supplemental charges. Typical healthcare swindlers.",Methodist Sugar Land Hospital
